### ISSUE TITLE
In Cisco ACE logs Host and Sourcetype is getting parsed incorrectly.

### ISSUE THREAD

**Issue by kailasnene** [splunk/splunk-connect-for-syslog#660]
We are forwarding these logs from Qradar collector (raw) and Splunk is parsing hostname of qradar as "host". Also in 'Sourcetype" it is parsing "nix:syslog" instead of cisco ACE.

Sample logs: (from Tcpdump on sc4s)

10:52:01.208904 IP X.X.X.X.55798 > X.X.X.X.514: SYSLOG daemon.info, length: 161
E.....@.>..~.7  z
X.(.......r<30>Aug 24 2020 08:52:00 <hostname>: %ACE-6-302026: Built ICMP connection for faddr X.X.X.X/36314 gaddr X.X.X.X/141 laddr X.X.X.X/768

10:52:01.724438 IP X.X.X.X.55798 > X.X.X.X.514: SYSLOG daemon.error, length: 142
E....d@.?....7  z
...........<27>Aug 24 2020 08:52:01 <hostname>: %ACE-3-251010: Health probe failed for server X.X.X.X on port 8000, server reply timeout

**Comment by rfaircloth-splunk** [comment]
Given the samples provided "qradar" is the correct host because the source does not include its own host reverse DNS is used

**Comment by rfaircloth-splunk** [comment]
Second issue, Cisco ACE is not a currently supported source, we can consider adding the source but because the source does not allow for sending host name it will not work in relay mode

**Comment by kailasnene** [comment]
Sorry Ryan while sanitizing sample logs, i accidentally deleted hostname from log. Here is correct one:

10:52:01.208904 IP X.X.X.X.55798 > X.X.X.X.514: SYSLOG daemon.info, length: 161
E.....@.>..~.7 z
X.(.......r<30>Aug 24 2020 08:52:00 HOSTNAME: %ACE-6-302026: Built ICMP connection for faddr X.X.X.X/36314 gaddr X.X.X.X/141 laddr X.X.X.X/768

10:52:01.724438 IP X.X.X.X.55798 > X.X.X.X.514: SYSLOG daemon.error, length: 142
E....d@.?....7 z
...........<27>Aug 24 2020 08:52:01 HOSTNAME: %ACE-3-251010: Health probe failed for server X.X.X.X on port 8000, server reply timeout

**Comment by rfaircloth-splunk** [comment]
Ok Adding support for this legacy source is possible

**Comment by rfaircloth-splunk** [comment]
Released
