### ISSUE TITLE
mGuard

### ISSUE THREAD

**Issue by mccain007** [splunk/splunk-connect-for-syslog#2435]
**What is the sc4s version ?**
sc4s version=3.22.5
**Is there a pcap available?**
no
**What the vendor name?**
Phoenix Contact
**What's the product name?**
mGuard
** Feature Request description: **
new filter
** Should it support TCP or UDP?**
both
** Do you want to have it for local usage or prepare a github PR? **
local

**Comment by ikheifets-splunk** [comment]
Please send me pcap file on email [ikheifets@splunk.com](mailto:ikheifets@splunk.com)

**Comment by ikheifets-splunk** [comment]
@mccain007 without pcap files (with log messages that producing your device) we can't implement parser for you

**Comment by mccain007** [comment]
Understood I was trying to get the pcap from the admin for mguard but he  hasn’t replied

Get Outlook for iOS<https://aka.ms/o0ukef>
________________________________

**Comment by mccain007** [comment]
Here is what the customer sent me:
Here we go ***@***.***:~$ sudo tcpdump host XX.XX.XX.229
tcpdump: verbose output suppressed, use -v[v]... for full protocol decode
listening on ens192, link-type EN10MB (Ethernet), snapshot length 262144 bytes
11:21:58.536095 ARP, Request who-has grp01.XXX.gov tell hqw-ntx-esx01.XXX.gov, length 46
11:22:33.125109 IP mdm.XXX.gov.46215 > grp01.XXX.gov.syslog: SYSLOG user.notice, length: 85
11:22:38.350866 ARP, Request who-has XXXgrp01.XXX.gov tell mdm.XXX.gov, length 28
11:22:38.351017 ARP, Reply XXXgrp01.XXX.gov is-at XXX:30:e7 (oui Unknown), length 46
11:22:55.612299 IP mdm.XXX.gov.46215 > XXXgrp01.XXX.gov.syslog: SYSLOG user.notice, length: 72
11:23:18.767188 IP mdm.XXX.gov.46215 > XXXgrp01.XXX.gov.syslog: SYSLOG user.notice, length: 63
11:23:23.918855 ARP, Request who-has XXXgrp01.XXX.gov tell mdm.XXX.gov, length 28
11:23:23.919074 ARP, Reply XXXgrp01.XXX.gov is-at XXX:30:e7 (oui Unknown), length 46
^C
8 packets captured
8 packets received by filter
0 packets dropped by kernel

do you want me to send you whats being captured by SC4S?  i can't connect to his server to do a pcap from the sc4s end.
________________________________

**Comment by ikheifets-splunk** [comment]
Hello, @mccain007 Send me please **pcap** file with **raw logs** that producing your device.
I already mentioned https://github.com/splunk/splunk-connect-for-syslog/issues/2435#issuecomment-2102831559

**Comment by ikheifets-splunk** [comment]
@mccain007 problem of your **tcpdump** that we can't see here log message content.
Please use official guide for [tcpdump](https://splunk.github.io/splunk-connect-for-syslog/main/gettingstarted/create-parser/#start-with-a-raw-log-message)

**Comment by ikheifets-splunk** [comment]
@mccain007 I closing this issue, because you haven't provide me pcap file, and I waiting for it month.
When you will provide I reopen this issue. You know that without examples of your log message impossible create a parser
